<?xml version="1.0" encoding="UTF-8"?>
<xs:schema xmlns:xs="http://www.w3.org/2001/XMLSchema"
targetNamespace="https://www.w3schools.com"
xmlns="https://www.w3schools.com"
elementFormDefault="qualified">
<xs:element name="familia">
  <xs:complexType>
    <xs:sequence>
      <xs:element name="elbebe" type="xs:string"/>
      <xs:element name="labebe" type="xs:string"/>
      <xs:element name="elbebe2" type="xs:string"/>
      <xs:element name="labebe2" type="xs:string"/>
      <xs:element name="hermano">
        <xs:complexType>
          <xs:sequence>
            <xs:element name="nombre" type="xs:string"/>
            <xs:element name="apellido" type="xs:string"/>
          </xs:sequence>
        </xs:complexType>
      </xs:element>
      <xs:element name="hermana">
        <xs:complexType>
          <xs:sequence>
            <xs:element name="nombre" type="xs:string"/>
            <xs:element name="apellido" type="xs:string"/>
          </xs:sequence>
        </xs:complexType>
      </xs:element>
    </xs:sequence>
  </xs:complexType>
</xs:element>
</xs:schema>